{"approvals":{"visibility":{"approved_at":"2026-08-05T05:26:10Z","approved_by":"Tyler","reference":"telegram://dm/eyeyesight/thread/6273/visibility-public-20260805","required":true,"status":"approved"}},"audit_digest":"6434c00a422229908a354328e27270ea19489dd532264161c22c7900a47358e4","audit_id":"launch-audit-20260805-live-guo","audit_kind":"one-time-launch-audit","completed_at":"2026-08-05T05:29:22Z","created_at":"2026-08-05T05:25:39Z","evidence":[{"authentication":"none","evidence_digest":"29761da58ef8a781280fc1adfafcf8f45cc83f8f6f17dedf12816256f9d9cabe","finding_ids":[],"id":"evidence-local-candidate","locator":"sealed-release:VPUB-20260805-live-guo/candidate:48e030a5fd07321c130d25b144e08b81bb233b2dd0a5d44700f460e6ad6e6b7b","observation":{"approved_path_count":39,"checks":["allowlist","sealed-artifact","rights","candidate-digest","custom-404"],"control_plane_state":"not-observed","result":"clear","surface":"local-mirror","visibility":"private"},"observed_at":"2026-08-05T05:25:39Z","pagination":"not-applicable","phase":"previsibility_audit","plane":"public-content-audit","result":"clear","source":"local-mirror","summary":"The formal candidate matched its approved sealed artifact, rights authority, exact file inventory, candidate digest, custom 404, and source release identity."},{"authentication":"authenticated","evidence_digest":"e21aeccb7e672ff3e973bba766556747a8624b3e0ab73b8de87d45d3b736691c","finding_ids":[],"id":"evidence-previsibility-github-api","locator":"gh-api-paginate:repos/eyeyesight/Tyler-Vault_PaperNote_ReadingSite@51411f59828748427e612b54a312e7346213d637","observation":{"checks":["metadata","refs","workflows","governance","pages-baseline","secret-metadata"],"control_plane_state":"matching","default_branch":"main","result":"clear","surface":"api","visibility":"private"},"observed_at":"2026-08-05T05:25:39Z","pagination":"complete","phase":"previsibility_audit","plane":"github-control-plane","result":"clear","source":"github-api","summary":"The authenticated paginated API lane recorded private visibility, exact main head, complete branch and tree inventory, no Pages/environment/gh-pages, and zero repository secret or variable metadata entries."},{"authentication":"authenticated","evidence_digest":"607556ec9dded71b4693850fe2bbff3dc40324cea7c545738e5433a37350dd28","finding_ids":[],"id":"evidence-public-repository","locator":"https://github.com/eyeyesight/Tyler-Vault_PaperNote_ReadingSite/tree/main","observation":{"checks":["identity","visibility","default-branch","head-commit","tree-inventory"],"control_plane_state":"matching","default_branch":"main","result":"clear","surface":"repository","visibility":"public"},"observed_at":"2026-08-05T05:26:54Z","pagination":"not-applicable","phase":"post_visibility_readback","plane":"github-control-plane","result":"clear","source":"github-repository","summary":"Authenticated repository readback confirmed public visibility, main as default branch, exact head 51411f59828748427e612b54a312e7346213d637, and the complete non-truncated tree."},{"authentication":"authenticated","evidence_digest":"9d0840512427518361cb27ab3defd85ef4c6f35dbcfb557199dd0dc485876dbc","finding_ids":[],"id":"evidence-postvisibility-github-api","locator":"gh-api-paginate:repos/eyeyesight/Tyler-Vault_PaperNote_ReadingSite/post-visibility","observation":{"checks":["metadata","refs","workflows","governance","pages-baseline","secret-metadata"],"control_plane_state":"matching","default_branch":"main","result":"clear","surface":"api","visibility":"public"},"observed_at":"2026-08-05T05:26:54Z","pagination":"complete","phase":"post_visibility_readback","plane":"github-control-plane","result":"clear","source":"github-api","summary":"The authenticated post-visibility API lane matched repository identity, public visibility, exact main head, branch/tree inventory, workflows, and the expected pre-Pages control-plane baseline."},{"authentication":"none","evidence_digest":"9c5822f24859cbd91a524031edf31cb4c8a98e4b606171475468f19ae406f5d0","finding_ids":[],"id":"evidence-anonymous-repository","locator":"https://api.github.com/repos/eyeyesight/Tyler-Vault_PaperNote_ReadingSite","observation":{"checks":["identity","visibility","default-branch","head-commit","complete-tree"],"control_plane_state":"matching","default_branch":"main","result":"clear","surface":"anonymous-repository","visibility":"public"},"observed_at":"2026-08-05T05:26:57Z","pagination":"not-applicable","phase":"post_visibility_readback","plane":"github-control-plane","result":"clear","source":"anonymous-repository","summary":"An unauthenticated GitHub API read confirmed the expected public repository identity, main head 51411f59828748427e612b54a312e7346213d637, and a complete non-truncated 166-entry tree."}],"finalized_at":"2026-08-05T05:29:22Z","findings":{"counts":{"control_plane":0,"disallowed_output":0,"repository":0,"rights_unknown":0,"secret":0},"items":[],"status":"clear"},"limitations":{"known_clones_and_cached_views":{"note":"The audit records known project-owned surfaces but does not claim that every clone or cache is absent.","status":"not-provable","zero_gate":false},"statement":"No evidence in this bounded audit proves that all external copies or caches are absent; that intentional limitation is non-blocking.","unknown_external_copies":{"note":"The audit is bounded to the sealed candidate and authenticated/anonymous repository readbacks; unknown external copies are not a zero gate.","status":"not-provable","zero_gate":false},"zero_gate":{"reason":"Known content, rights, byte identity, and provider state can be gated without claiming global absence of external copies.","required_for_launch":false}},"repository":{"default_branch":"main","html_url":"https://github.com/eyeyesight/Tyler-Vault_PaperNote_ReadingSite","name":"Tyler-Vault_PaperNote_ReadingSite","owner":"eyeyesight","target_visibility":"public"},"schema_version":1,"scope":{"anonymous_repository_readback":{"after_visibility_change":true,"authentication":"none","checks":["public repository identity and visibility","default branch head and complete tree","anonymous repository response matches the approved visibility state"],"required":true},"authenticated_github_evidence":{"machine_lane":{"authentication":"authenticated","checks":["repository metadata and default-branch readback","branches, workflows, rulesets, environments, Pages and Actions settings","relevant repository lists paginated to exhaustion"],"pagination":"complete","required":true,"single_lane":true,"transport":"gh-api-paginate"},"required":true,"ui_corroboration":{"required":false,"role":"corroboration-only"}},"lifecycle_phases":["previsibility_audit","visibility_approval","post_visibility_readback","finalize_launch_audit"],"post_visibility_readback":{"after_visibility_change":true,"checks":["public repository identity, visibility, default branch and head commit","authenticated API readback matches the visibility transition","anonymous API readback matches the expected public repository"],"required":true,"surfaces":["repository","api","anonymous-repository"]},"previsibility_audit":{"checks":["approved public-output allowlist","sealed artifact and release identity","rights disposition for every published unit"],"local_mirror":{"checks":["approved candidate exact-byte inventory","sealed artifact digest","rights disposition and disallowed-output scan"],"required":true,"root":"sealed-release:VPUB-20260805-live-guo"},"required":true},"sealed_artifact_digest":"cc28024fa098c9a93eb2258e5e8922e9329a54be7f7146a74177c336eef7c4dc","source_commit":"51411f59828748427e612b54a312e7346213d637"},"summary":"The bounded first-launch audit verified the approved sealed candidate and content/rights inventory, recorded the authenticated private repository state before the authorized visibility change, and read back the public repository through authenticated and anonymous lanes. No launch-blocking content, rights, repository, or control-plane finding was observed. Pages deployment QA is intentionally outside this audit.","visibility_changed_at":"2026-08-05T05:26:11Z"}
